{
  "schema": "dolly.extension-rpc-registry/v1",
  "protocol": { "major": 1, "minor": 0 },
  "error_data_schema": "https://dolly.example/spec/0.1/schemas/error.schema.json",
  "requests": [
    {
      "method": "extension.initialize",
      "caller": "host",
      "params_schema": "https://dolly.example/spec/0.1/schemas/extension-initialize-request.schema.json",
      "result_schema": "https://dolly.example/spec/0.1/schemas/extension-initialize-result.schema.json",
      "deadline": { "kind": "params_pointer", "pointer": "/deadline" },
      "operation_identity": { "scope": "connection_generation", "pointers": ["/worker_epoch", "/extension_generation"] },
      "reconciliation": { "kind": "process_state", "method": null },
      "unknown_policy": "process_state_authoritative",
      "state_changing": true
    },
    {
      "method": "extension.ping",
      "caller": "host",
      "params_schema": "https://dolly.example/spec/0.1/schemas/extension-lifecycle-rpc.schema.json#/$defs/ExtensionPingParams",
      "result_schema": "https://dolly.example/spec/0.1/schemas/extension-lifecycle-rpc.schema.json#/$defs/ExtensionPingResult",
      "deadline": { "kind": "params_pointer", "pointer": "/deadline" },
      "operation_identity": { "scope": "extension_process", "pointers": ["/operation_id"] },
      "reconciliation": { "kind": "read_retry", "method": null },
      "unknown_policy": "read_retry",
      "state_changing": false
    },
    {
      "method": "extension.shutdown",
      "caller": "host",
      "params_schema": "https://dolly.example/spec/0.1/schemas/extension-lifecycle-rpc.schema.json#/$defs/ExtensionShutdownParams",
      "result_schema": "https://dolly.example/spec/0.1/schemas/extension-lifecycle-rpc.schema.json#/$defs/ExtensionShutdownResult",
      "deadline": { "kind": "params_pointer", "pointer": "/deadline" },
      "operation_identity": { "scope": "extension_process", "pointers": ["/operation_id"] },
      "reconciliation": { "kind": "process_state", "method": null },
      "unknown_policy": "process_state_authoritative",
      "state_changing": true
    },
    {
      "method": "module.instantiate",
      "caller": "host",
      "params_schema": "https://dolly.example/spec/0.1/schemas/extension-lifecycle-rpc.schema.json#/$defs/ModuleInstantiateParams",
      "result_schema": "https://dolly.example/spec/0.1/schemas/extension-lifecycle-rpc.schema.json#/$defs/ModuleInstantiateResult",
      "deadline": { "kind": "params_pointer", "pointer": "/deadline" },
      "operation_identity": { "scope": "module", "pointers": ["/module_id", "/operation_id"] },
      "reconciliation": { "kind": "method", "method": "module.operation_status" },
      "unknown_policy": "same_identity_only",
      "state_changing": true
    },
    {
      "method": "module.activate",
      "caller": "host",
      "params_schema": "https://dolly.example/spec/0.1/schemas/activation-request.schema.json",
      "result_schema": "https://dolly.example/spec/0.1/schemas/activation-result.schema.json",
      "deadline": { "kind": "manifest_pointer", "pointer": "/manifest/deadline" },
      "operation_identity": { "scope": "activation", "pointers": ["/manifest/activation_id", "/attempt", "/lease_generation", "/lease_token"] },
      "reconciliation": { "kind": "frozen_activation", "method": null },
      "unknown_policy": "frozen_activation_contract",
      "state_changing": true
    },
    {
      "method": "module.prepare_config",
      "caller": "host",
      "params_schema": "https://dolly.example/spec/0.1/schemas/extension-lifecycle-rpc.schema.json#/$defs/ModulePrepareConfigParams",
      "result_schema": "https://dolly.example/spec/0.1/schemas/extension-lifecycle-rpc.schema.json#/$defs/ModulePrepareConfigResult",
      "deadline": { "kind": "params_pointer", "pointer": "/deadline" },
      "operation_identity": { "scope": "configuration_transaction", "pointers": ["/module_id", "/operation_id"] },
      "reconciliation": { "kind": "method", "method": "module.operation_status" },
      "unknown_policy": "same_identity_only",
      "state_changing": true
    },
    {
      "method": "module.commit_config",
      "caller": "host",
      "params_schema": "https://dolly.example/spec/0.1/schemas/extension-lifecycle-rpc.schema.json#/$defs/ModuleCommitConfigParams",
      "result_schema": "https://dolly.example/spec/0.1/schemas/extension-lifecycle-rpc.schema.json#/$defs/ModuleCommitConfigResult",
      "deadline": { "kind": "params_pointer", "pointer": "/deadline" },
      "operation_identity": { "scope": "configuration_transaction", "pointers": ["/module_id", "/operation_id"] },
      "reconciliation": { "kind": "method", "method": "module.operation_status" },
      "unknown_policy": "same_identity_only",
      "state_changing": true
    },
    {
      "method": "module.abort_config",
      "caller": "host",
      "params_schema": "https://dolly.example/spec/0.1/schemas/extension-lifecycle-rpc.schema.json#/$defs/ModuleAbortConfigParams",
      "result_schema": "https://dolly.example/spec/0.1/schemas/extension-lifecycle-rpc.schema.json#/$defs/ModuleAbortConfigResult",
      "deadline": { "kind": "params_pointer", "pointer": "/deadline" },
      "operation_identity": { "scope": "configuration_transaction", "pointers": ["/module_id", "/operation_id"] },
      "reconciliation": { "kind": "method", "method": "module.operation_status" },
      "unknown_policy": "same_identity_only",
      "state_changing": true
    },
    {
      "method": "module.snapshot",
      "caller": "host",
      "params_schema": "https://dolly.example/spec/0.1/schemas/extension-lifecycle-rpc.schema.json#/$defs/ModuleSnapshotParams",
      "result_schema": "https://dolly.example/spec/0.1/schemas/extension-lifecycle-rpc.schema.json#/$defs/ModuleSnapshotResult",
      "deadline": { "kind": "params_pointer", "pointer": "/deadline" },
      "operation_identity": { "scope": "module", "pointers": ["/module_id", "/operation_id"] },
      "reconciliation": { "kind": "method", "method": "module.operation_status" },
      "unknown_policy": "same_identity_only",
      "state_changing": true
    },
    {
      "method": "module.restore",
      "caller": "host",
      "params_schema": "https://dolly.example/spec/0.1/schemas/extension-lifecycle-rpc.schema.json#/$defs/ModuleRestoreParams",
      "result_schema": "https://dolly.example/spec/0.1/schemas/extension-lifecycle-rpc.schema.json#/$defs/ModuleRestoreResult",
      "deadline": { "kind": "params_pointer", "pointer": "/deadline" },
      "operation_identity": { "scope": "module", "pointers": ["/module_id", "/operation_id"] },
      "reconciliation": { "kind": "method", "method": "module.operation_status" },
      "unknown_policy": "same_identity_only",
      "state_changing": true
    },
    {
      "method": "module.migrate_state",
      "caller": "host",
      "params_schema": "https://dolly.example/spec/0.1/schemas/extension-lifecycle-rpc.schema.json#/$defs/ModuleMigrateStateParams",
      "result_schema": "https://dolly.example/spec/0.1/schemas/extension-lifecycle-rpc.schema.json#/$defs/ModuleMigrateStateResult",
      "deadline": { "kind": "params_pointer", "pointer": "/deadline" },
      "operation_identity": { "scope": "module", "pointers": ["/module_id", "/operation_id"] },
      "reconciliation": { "kind": "method", "method": "module.operation_status" },
      "unknown_policy": "same_identity_only",
      "state_changing": true
    },
    {
      "method": "module.operation_status",
      "caller": "host",
      "params_schema": "https://dolly.example/spec/0.1/schemas/extension-lifecycle-rpc.schema.json#/$defs/ModuleOperationStatusParams",
      "result_schema": "https://dolly.example/spec/0.1/schemas/extension-lifecycle-rpc.schema.json#/$defs/ModuleOperationStatusResult",
      "deadline": { "kind": "params_pointer", "pointer": "/deadline" },
      "operation_identity": { "scope": "module", "pointers": ["/module_id", "/operation_id", "/target_operation_id", "/target_method"] },
      "reconciliation": { "kind": "read_retry", "method": null },
      "unknown_policy": "read_retry",
      "state_changing": false
    },
    {
      "method": "module.health",
      "caller": "host",
      "params_schema": "https://dolly.example/spec/0.1/schemas/extension-lifecycle-rpc.schema.json#/$defs/ModuleHealthParams",
      "result_schema": "https://dolly.example/spec/0.1/schemas/extension-lifecycle-rpc.schema.json#/$defs/ModuleHealthResult",
      "deadline": { "kind": "params_pointer", "pointer": "/deadline" },
      "operation_identity": { "scope": "module", "pointers": ["/module_id", "/operation_id"] },
      "reconciliation": { "kind": "read_retry", "method": null },
      "unknown_policy": "read_retry",
      "state_changing": false
    },
    {
      "method": "module.shutdown",
      "caller": "host",
      "params_schema": "https://dolly.example/spec/0.1/schemas/extension-lifecycle-rpc.schema.json#/$defs/ModuleShutdownParams",
      "result_schema": "https://dolly.example/spec/0.1/schemas/extension-lifecycle-rpc.schema.json#/$defs/ModuleShutdownResult",
      "deadline": { "kind": "params_pointer", "pointer": "/deadline" },
      "operation_identity": { "scope": "module", "pointers": ["/module_id", "/operation_id"] },
      "reconciliation": { "kind": "method", "method": "module.operation_status" },
      "unknown_policy": "same_identity_only",
      "state_changing": true
    },
    {
      "method": "host.block.get",
      "caller": "extension",
      "params_schema": "https://dolly.example/spec/0.1/schemas/host-resource-rpc.schema.json#/$defs/BlockGetParams",
      "result_schema": "https://dolly.example/spec/0.1/schemas/block.schema.json",
      "deadline": { "kind": "params_pointer", "pointer": "/deadline" },
      "operation_identity": { "scope": "authenticated_module", "pointers": ["/module_id", "/operation_id"] },
      "reconciliation": { "kind": "read_retry", "method": null },
      "unknown_policy": "read_retry",